{
  "required" : true ,
  "$schema" : "http://json-schema.org/draft-03/schema" ,
  "type" : "object" ,
  "properties" : {
    "success" : {
      "type" : "boolean" ,
      "required" : false
    } ,
    "buffer_count" : {
      "type" : "number" ,
      "required" : false
    } ,
    "buffer_percentage" : {
      "type" : "number" ,
      "required" : false
    } ,
    "updates" : {
      "type" : "array" ,
      "required" : false ,
      "items" : 
        {
          "type" : "object" ,
          "properties" : {
            "id" : {
              "type" : "string" ,
              "required" : false
            } ,
            "created_at" : {
              "type" : "number" ,
              "required" : false
            } ,
            "day" : {
              "type" : "string" ,
              "required" : false
            } ,
            "due_at" : {
              "type" : "number" ,
              "required" : false
            } ,
            "due_time" : {
              "type" : "string" ,
              "required" : false
            } ,
            "media" : {
              "type" : "object" ,
              "required" : false ,
              "properties" : {
                "link" : {
                  "type" : "string" ,
                  "required" : false
                } ,
                "title" : {
                  "type" : "string" ,
                  "required" : false
                } ,
                "description" : {
                  "type" : "string" ,
                  "required" : false
                }
              }
            } ,
            "profile_id" : {
              "type" : "string" ,
              "required" : false
            } ,
            "profile_service" : {
              "type" : "string" ,
              "required" : false
            } ,
            "status" : {
              "type" : "string" ,
              "required" : false
            } ,
            "text" : {
              "type" : "string" ,
              "required" : false
            } ,
            "text_formatted" : {
              "type" : "string" ,
              "required" : false
            } ,
            "user_id" : {
              "type" : "string" ,
              "required" : false
            } ,
            "via" : {
              "type" : "string" ,
              "required" : false
            }
          }
        }
      
    }
  }
}